{
    "name": "access-control-role",
    "label": "Access Control (Role)",
    "description": "A role-based access control starter using a simple role mapping.",
    "details": "Illustrates a lightweight role-based pattern (assign/revoke/check role) suitable for permissioned flows.",
    "version": "0.1.0",
    "fhevm_version": "0.1.0",
    "category": "patterns",
    "chapter": "access-control",
    "concepts": [],
    "tags": [
        "Infra",
        "Access"
    ],
    "authors": [
        {
            "name": "starterkit"
        }
    ],
    "has_ui": false
}
